{
  "schema_version": "strategy_spec_variant_planning_approval_audit_v1",
  "audit_record_id": "VPAUDIT-VPAPP-20260712-EXAMPLE1",
  "approval_id": "VPAPP-20260712-EXAMPLE1",
  "approval_path": "research/strategy_spec_variant_planning_approvals/VPAPP-20260712-EXAMPLE1.variant_planning_approval.json",
  "approval_file_sha256": "sha256:9f1fc99d298491590078bc80be2697922accc650a00b5f6b9e28c181d3599d5a",
  "strategy_spec_id": "STRAT-SPEC-0007",
  "strategy_spec_path": "research/strategy_specs/STRAT-SPEC-0007.strategy_spec.json",
  "strategy_spec_sha256": "sha256:b23ebc1093df51b7fab5e39c46fd2b96b5e71d35300134eb319a5cbc32d0857c",
  "gate_c_audit_path": "research/canonical_crossing_audit/strategy_spec_writes.jsonl",
  "gate_c_audit_line_number": 1,
  "gate_c_raw_record_sha256": "sha256:ef5a452a4aff61a35fdbdfcf16162362400345f28af67b7bb41aa4ae36024be2",
  "gate_c_approval_id": "GATE-C-H004-R2-0001",
  "variant_manifest_id": "VM-0007",
  "variant_manifest_path": "research/variant_manifests/VM-0007.variant_manifest.json",
  "search_family_id": "SF-H004-R2-EMA-PULLBACK-CONTINUATION-1D-0001",
  "contract_core_sha256": "sha256:4b8e126870c918e88ac42336427c3ba495bcacb6433bd3741b0a01c712bf99f0",
  "committed_population_count": 81,
  "approved_at": "2026-07-12T12:00:00Z",
  "writer_version": "variant_planning_approval_writer_v1",
  "validation_outcome": "passed_before_write",
  "no_gate_q": true,
  "no_queue_admission": true,
  "no_dispatch": true,
  "no_research_execution": true,
  "no_result_population": true,
  "no_candidate_action": true,
  "no_runtime_or_paper_live": true
}
